{
  "$schema": "https://json-schema.org/draft/2020-12/schema",
  "$id": "https://github.com/brucedombrowski/requirements/schemas/standard.schema.json",
  "title": "Standard Definition",
  "description": "Schema for standard/regulation metadata. Each standard is defined once and referenced by ID across the catalog.",
  "type": "object",
  "required": ["id", "name", "type", "issuing_organization", "url"],
  "properties": {
    "id": {
      "type": "string",
      "description": "Unique identifier used to reference this standard (e.g., NIST-SP-800-53)."
    },
    "name": {
      "type": "string",
      "description": "Full official title."
    },
    "short_name": {
      "type": "string",
      "description": "Abbreviated name for display."
    },
    "type": {
      "type": "string",
      "enum": [
        "standard",
        "regulation",
        "executive_order",
        "registry",
        "federal_regulation",
        "constitutional_provision",
        "statute",
        "omb_circular",
        "fips",
        "agency_policy",
        "agency_procedure",
        "handbook"
      ],
      "description": "Classification of the standard."
    },
    "issuing_organization": {
      "type": "string",
      "description": "Organization that published this standard."
    },
    "revision": {
      "type": "string",
      "description": "Revision or version identifier."
    },
    "publication_date": {
      "type": "string",
      "format": "date",
      "description": "Date of publication."
    },
    "url": {
      "type": "string",
      "format": "uri",
      "description": "Canonical URL."
    },
    "local_copy": {
      "type": "string",
      "description": "Repo-relative path to a local copy of the source document (e.g., sources/nasa/npr-2810-7.pdf). Optional — captured for clean-room provenance."
    },
    "sha256": {
      "type": "string",
      "pattern": "^[0-9a-f]{64}$",
      "description": "SHA-256 hex digest of local_copy. Allows verifying that a downloaded source matches the version this catalog was decomposed from."
    },
    "date_accessed": {
      "type": "string",
      "format": "date",
      "description": "Date the local_copy was downloaded from url. Important for sources that may change without versioning."
    },
    "supersedes": {
      "type": "string",
      "description": "ID of the standard this one supersedes."
    },
    "status": {
      "type": "string",
      "enum": ["active", "withdrawn", "superseded"],
      "description": "Current status."
    },
    "notes": {
      "type": "string",
      "description": "Additional context."
    },
    "tier": {
      "type": "integer",
      "minimum": 0,
      "maximum": 9,
      "description": "Hierarchy level for authority graph layout. 0=Constitution, 1=Statute, 2=Executive Order, 3=OMB Policy, 4=Federal Regulation, 5=FIPS, 6=NIST SP/NARA, 7=Agency Policy, 8=Agency Procedure, 9=Handbook."
    },
    "authority": {
      "type": "object",
      "description": "Authority relationships to other standards in the graph.",
      "properties": {
        "derives_from": {
          "type": "array",
          "description": "Vertical authority chain — where this standard gets its legal authority.",
          "items": {
            "type": "object",
            "required": ["id"],
            "properties": {
              "id": {
                "type": "string",
                "description": "ID of the parent authority standard."
              },
              "relationship": {
                "type": "string",
                "enum": ["implements", "authorized_by", "mandated_by", "derived_from"],
                "description": "Nature of the authority relationship."
              },
              "section": {
                "type": "string",
                "description": "Specific section of the parent standard."
              },
              "note": {
                "type": "string",
                "description": "Explanatory note about this relationship."
              }
            },
            "additionalProperties": false
          }
        },
        "references": {
          "type": "array",
          "description": "Lateral cross-references — related but not authority-granting.",
          "items": {
            "type": "object",
            "required": ["id"],
            "properties": {
              "id": {
                "type": "string",
                "description": "ID of the referenced standard."
              },
              "section": {
                "type": "string",
                "description": "Specific section referenced."
              },
              "note": {
                "type": "string",
                "description": "Explanatory note about this reference."
              }
            },
            "additionalProperties": false
          }
        }
      },
      "additionalProperties": false
    }
  },
  "additionalProperties": false
}
