{
  "id": "FIPS-140-2",
  "name": "Security Requirements for Cryptographic Modules",
  "short_name": "FIPS 140-2",
  "type": "fips",
  "issuing_organization": "National Institute of Standards and Technology",
  "publication_date": "2001-05-25",
  "url": "https://csrc.nist.gov/pubs/fips/140-2/final",
  "supersedes": "FIPS-140-1",
  "status": "active",
  "tier": 5,
  "notes": "Specifies security requirements for cryptographic modules in four increasing levels. FIPS 140-3 is the successor but 140-2 remains widely referenced.",
  "authority": {
    "derives_from": [
      {
        "id": "44-USC-CH35",
        "relationship": "mandated_by",
        "note": "FISMA directs NIST to develop cryptographic standards."
      },
      {
        "id": "40-USC-11331",
        "relationship": "mandated_by",
        "note": "Authorizes NIST to promulgate compulsory federal information security standards."
      }
    ]
  }
}
