{
  "id": "ITS-HBK-CUI",
  "name": "NASA CUI Handbook",
  "short_name": "ITS-HBK-2810.09-02",
  "type": "handbook",
  "issuing_organization": "National Aeronautics and Space Administration",
  "url": "https://nodis3.gsfc.nasa.gov/displayDir.cfm?Internal_ID=N_PR_2810_0007_&page_name=main",
  "status": "active",
  "tier": 9,
  "notes": "Operational handbook providing step-by-step procedures for NASA CUI handling, marking, and safeguarding. Original canonical URL (https://nodis3.gsfc.nasa.gov/OPD_Docs/ITS-HBK-2810.09-02_.pdf) returns 404 — NASA does not appear to host this handbook publicly anymore, and it may itself be outdated. URL points at the parent NPR 2810.7 NODIS page for context. Included in the catalog for authority-chain completeness only.",
  "authority": {
    "derives_from": [
      {
        "id": "NPR-2810-7",
        "relationship": "derived_from",
        "note": "Detailed procedural guidance implementing NPR 2810.7."
      }
    ],
    "references": [
      {
        "id": "NARA-CUI-MARKING-HBK",
        "note": "Aligns with NARA marking guidance."
      }
    ]
  }
}
