{
  "id": "44-USC-CH35",
  "name": "Federal Information Security Modernization Act (FISMA) \u2014 44 U.S.C. Chapter 35",
  "short_name": "44 U.S.C. Ch. 35 (FISMA)",
  "type": "statute",
  "issuing_organization": "United States Congress",
  "url": "https://uscode.house.gov/view.xhtml?path=/prelim@title44/chapter35&edition=prelim",
  "local_copy": "sources/federal/44-usc-ch35.pdf",
  "sha256": "018a1d949a3e5a949f051b4f65329e52906edcced6aa79592f390f2ce8a64eff",
  "date_accessed": "2026-05-07",
  "status": "active",
  "tier": 1,
  "notes": "Establishes federal information security requirements. Mandates NIST to develop standards and guidelines for federal information systems.",
  "authority": {
    "derives_from": [
      {
        "id": "USC-CONST",
        "relationship": "authorized_by",
        "section": "Art. I, \u00a7 8, cl. 18; Art. IV, \u00a7 3, cl. 2",
        "note": "Necessary & Proper Clause (Art. I \u00a7 8 cl. 18) for legislating on federal information-system administration; Property Clause (Art. IV \u00a7 3 cl. 2) for governance of federal information assets as government property."
      }
    ]
  }
}
