{
  "id": "EO-13556",
  "name": "Establishing the Controlled Unclassified Information Program",
  "short_name": "EO 13556",
  "type": "executive_order",
  "issuing_organization": "Executive Office of the President",
  "publication_date": "2010-11-04",
  "url": "https://www.archives.gov/cui/registry/policy-guidance",
  "status": "active",
  "notes": "Established the government-wide CUI program to standardize handling of unclassified information requiring safeguarding."
}
