{
  "id": "NIST-SP-800-88",
  "name": "Guidelines for Media Sanitization",
  "short_name": "NIST SP 800-88 Rev 1",
  "type": "standard",
  "issuing_organization": "National Institute of Standards and Technology",
  "revision": "Rev 1",
  "publication_date": "2014-12-18",
  "url": "https://csrc.nist.gov/pubs/sp/800/88/r1/final",
  "local_copy": "sources/nist/NIST.SP.800-88r1.pdf",
  "sha256": "acd2315cb1823d51db93b180d898fabfdf5e964e3fcb41cf44d14b4c3ec8c5c4",
  "date_accessed": "2026-05-07",
  "status": "active",
  "tier": 6,
  "notes": "Provides guidance on media sanitization methods (Clear, Purge, Destroy) for different media types.",
  "authority": {
    "derives_from": [
      {
        "id": "44-USC-CH35",
        "relationship": "mandated_by",
        "note": "FISMA directs NIST to develop security guidelines including media protection."
      }
    ],
    "references": [
      {
        "id": "NIST-SP-800-53",
        "section": "MP-6",
        "note": "Provides detailed guidance for implementing the MP-6 Media Sanitization control."
      }
    ]
  }
}
