{
  "id": "32-CFR-2002",
  "name": "Controlled Unclassified Information",
  "short_name": "32 CFR Part 2002",
  "type": "federal_regulation",
  "issuing_organization": "National Archives and Records Administration",
  "publication_date": "2016-09-14",
  "url": "https://www.ecfr.gov/current/title-32/subtitle-B/chapter-XX/part-2002",
  "status": "active",
  "notes": "Implements EO 13556 by establishing uniform CUI handling requirements across the executive branch."
}
