{
  "id": "FIPS-199",
  "name": "Standards for Security Categorization of Federal Information and Information Systems",
  "short_name": "FIPS 199",
  "type": "fips",
  "issuing_organization": "National Institute of Standards and Technology",
  "publication_date": "2004-02-01",
  "url": "https://csrc.nist.gov/pubs/fips/199/final",
  "status": "active",
  "tier": 5,
  "notes": "Defines security categories (Low, Moderate, High) based on confidentiality, integrity, and availability impact levels.",
  "authority": {
    "derives_from": [
      {
        "id": "44-USC-CH35",
        "relationship": "mandated_by",
        "note": "FISMA directs NIST to develop security standards including categorization."
      },
      {
        "id": "40-USC-11331",
        "relationship": "mandated_by",
        "note": "Authorizes NIST to promulgate compulsory federal information security standards."
      }
    ]
  }
}
